{
  "protocol": {
    "name": "qf-protocol",
    "version": "1.0.0"
  },
  "id": "urn:uuid:550e8400-e29b-41d4-a716-446655440000",
  "time": "2025-10-30T12:19:29Z",
  "sender": {
    "role": "SR",
    "agent": "human:alice"
  },
  "receiver": {
    "role": "LW"
  },
  "intent": "hook.create",
  "context": {
    "hot_cold": "hot",
    "tu": "TU-2025-10-30-SR01",
    "loop": "Hook Harvest"
  },
  "safety": {
    "player_safe": false,
    "spoilers": "allowed"
  },
  "payload": {
    "type": "hook_card",
    "data": {
      "header": {
        "short_name": "Shadow Toll at Wormhole 3",
        "id": "HK-20251030-01",
        "status": "proposed",
        "raised_by": "SR",
        "tu": "TU-2025-10-30-SR01",
        "edited": "2025-10-30",
        "slice": "Add recurring resource pressure at major hub",
        "snapshot_context": "Cold @ 2025-10-28"
      },
      "classification": {
        "type_primary": "narrative",
        "bars_affected": ["Integrity", "Nonlinearity"],
        "blocking": "no"
      },
      "player_safe_summary": "New faction mechanic at major hub",
      "proposed_next_step": {
        "loop": "Lore Deepening",
        "owner_r": "LW",
        "accountable_a": "SR"
      },
      "acceptance_criteria": [
        "Canon entry for toll mechanism completed",
        "Integration points with existing factions identified"
      ],
      "locations_links": {
        "locations": ["manuscript/sections/wormhole3.md"],
        "related_hooks": [],
        "lineage": "TU-2025-10-30-SR01"
      }
    }
  },
  "refs": [
    "TU-2025-10-30-SR01"
  ],
  "correlation_id": "corr-hook-harvest-2025-10-30"
}
