{
  "protocol": {
    "name": "qf-protocol",
    "version": "1.0.0"
  },
  "id": "urn:uuid:d4e5f6a7-b8c9-4012-d345-67890abcdef0",
  "time": "2025-10-30T16:00:00Z",
  "sender": {
    "role": "GK",
    "agent": "human:charlie"
  },
  "receiver": {
    "role": "LW"
  },
  "intent": "gate.decision",
  "context": {
    "hot_cold": "hot",
    "tu": "TU-2025-10-30-LW01",
    "snapshot": "Cold @ 2025-10-28",
    "loop": "Lore Deepening"
  },
  "safety": {
    "player_safe": false,
    "spoilers": "allowed"
  },
  "payload": {
    "type": "gatecheck_report",
    "data": {
      "title": "TU-2025-10-30-LW01 Final Gate Decision",
      "checked": "2025-10-30",
      "gatekeeper": "human:charlie",
      "scope": "Canon entry for Shadow Toll faction mechanic",
      "mode": "gatecheck",
      "cold_snapshot": "Cold @ 2025-10-28",
      "artifacts_samples": [
        "canon_pack/shadow_toll_faction.json",
        "manuscript/sections/wormhole3.md"
      ],
      "decision": "pass",
      "why": "All bars green; toll mechanism clearly documented; integration points explicit",
      "next_actions": "SR to merge TU-2025-10-30-LW01 to Cold",
      "bars": [
        {
          "bar": "Integrity",
          "status": "green",
          "evidence": "Toll trigger conditions explicit; faction lore complete"
        },
        {
          "bar": "Reachability",
          "status": "green",
          "evidence": "All canon entries reachable from hub navigation"
        },
        {
          "bar": "Nonlinearity",
          "status": "green",
          "evidence": "Toll creates new branch at hub; choices clear"
        },
        {
          "bar": "Gateways",
          "status": "green",
          "evidence": "Hub connections properly gated with toll mechanism"
        },
        {
          "bar": "Style",
          "status": "green",
          "evidence": "Faction lore matches established voice and tone"
        },
        {
          "bar": "Determinism",
          "status": "green",
          "evidence": "Toll mechanics deterministic; no random elements"
        },
        {
          "bar": "Presentation",
          "status": "green",
          "evidence": "All surfaces player-safe; no spoilers or internals"
        },
        {
          "bar": "Accessibility",
          "status": "green",
          "evidence": "Faction descriptions include alt text; reading order clear"
        }
      ],
      "handoffs": [
        "SR: Approve merge to Cold for TU-2025-10-30-LW01 by 2025-10-31"
      ],
      "checklist": [
        "Decision pass is consistent with all-green bars",
        "Smallest viable fixes documented for yellow/red bars (none needed)",
        "Player safety verified across all content surfaces",
        "Dormancy state recorded (no deferrals)",
        "Handoffs documented with owners and deadlines",
        "Trace links updated in canon_pack lineage"
      ]
    }
  },
  "refs": [
    "TU-2025-10-30-LW01"
  ],
  "correlation_id": "corr-lore-deepening-2025-10-30",
  "reply_to": "urn:uuid:c3d4e5f6-a7b8-4901-c234-567890abcdef"
}
