{
  "protocol": {
    "name": "qf-protocol",
    "version": "1.0.0"
  },
  "id": "urn:uuid:c3d4e5f6-a7b8-4901-c234-567890abcdef",
  "time": "2025-10-30T15:30:00Z",
  "sender": {
    "role": "LW",
    "agent": "human:bob"
  },
  "receiver": {
    "role": "GK"
  },
  "intent": "gate.report.submit",
  "context": {
    "hot_cold": "hot",
    "tu": "TU-2025-10-30-LW01",
    "snapshot": "Cold @ 2025-10-28",
    "loop": "Lore Deepening"
  },
  "safety": {
    "player_safe": false,
    "spoilers": "allowed"
  },
  "payload": {
    "type": "gatecheck_report",
    "data": {
      "title": "TU-2025-10-30-LW01 Pre-Gate",
      "checked": "2025-10-30",
      "gatekeeper": "human:charlie",
      "scope": "Canon entry for Shadow Toll faction mechanic",
      "mode": "pre-gate",
      "cold_snapshot": "Cold @ 2025-10-28",
      "artifacts_samples": [
        "canon_pack/shadow_toll_faction.json",
        "manuscript/sections/wormhole3.md"
      ],
      "decision": "conditional pass",
      "why": "Canon pack complete, but manuscript integration needs clarity on toll trigger conditions",
      "next_actions": "LW to add toll trigger conditions to manuscript integration notes; resubmit for final gate",
      "bars": [
        {
          "bar": "Integrity",
          "status": "yellow",
          "evidence": "Toll mechanism referenced but trigger conditions not explicit",
          "smallest_viable_fix": "Add 2-3 sentences clarifying when toll is triggered"
        },
        {
          "bar": "Nonlinearity",
          "status": "green",
          "evidence": "Toll creates new branch at hub; choices clear",
          "smallest_viable_fix": "None needed"
        },
        {
          "bar": "Presentation",
          "status": "green",
          "evidence": "All surfaces player-safe; no spoilers or internals",
          "smallest_viable_fix": "None needed"
        }
      ],
      "handoffs": []
    }
  },
  "refs": [
    "TU-2025-10-30-LW01"
  ],
  "correlation_id": "corr-lore-deepening-2025-10-30"
}
